{
  "schemaVersion": 1,
  "humanFeedback": false,
  "environment": {
    "kind": "fixed-independent",
    "execution": "installed-npm-tarball",
    "repository": "https://github.com/NVIDIA/skills",
    "commit": "f1f4c7a8bff9676ffa73a7874b6e5e27aa4ee3a0",
    "selectionDigest": "91f97562b0b114214e2135a783b999b0213e8ba63d40cca2ea1774cc838ded91",
    "license": [
      "CC-BY-4.0",
      "Apache-2.0"
    ]
  },
  "counts": {
    "observed": 48,
    "inventory": 46,
    "public": 44,
    "reviewRequired": 2,
    "localOnly": 2
  },
  "v1": {
    "generatedAt": "2026-07-21T20:00:00.000Z",
    "inventorySnapshotId": "inventory-snapshot:schemaversion-1-projectid-independen:8a750447f977",
    "librarySnapshotId": "library-snapshot:schemaversion-1-projectid-independen:c0438d15dac6",
    "siteManifestDigest": "869105940645b7b86e844bbfa5eb8ca2bb2dc39c6222d17c10fb57f316914011",
    "distDigest": "49bf02bab8fc4ab21d4bb590456d2a09d28e0553bc20d8ef9391dbc0e834323d",
    "doctorStatus": "ok"
  },
  "v2": {
    "generatedAt": "2026-07-22T20:00:00.000Z",
    "inventorySnapshotId": "inventory-snapshot:schemaversion-1-projectid-independen:41b4e6e7ee3e",
    "librarySnapshotId": "library-snapshot:schemaversion-1-projectid-independen:633f4c07c827",
    "siteManifestDigest": "e490cf3e97b3417392b68560eceb4f704f001e4c902ffd10fd812fc11a6fd792",
    "distDigest": "61035410973d50f811b0814529f597eff6c326aebbf373862c43fe27e269a1a2",
    "doctorStatus": "ok"
  },
  "diff": {
    "added": [
      "doca-container-deployment"
    ],
    "changed": [
      "amc-run-sample-calibration",
      "cuopt-routing-api-python",
      "deepstream-import-vision-model"
    ],
    "removed": [
      "cuopt-developer"
    ],
    "summary": {
      "added": 1,
      "changed": 3,
      "removed": 1
    }
  },
  "postGenerateDiff": {
    "added": [],
    "changed": [],
    "removed": [],
    "summary": {
      "added": 0,
      "changed": 0,
      "removed": 0
    }
  },
  "privacy": {
    "status": "pass",
    "forbiddenFindings": 0
  },
  "compatibility": {
    "skills": 142,
    "libraries": 28,
    "categories": 9
  },
  "release": {
    "privateGates": "pass",
    "publicRc": "pass",
    "draftPr": "https://github.com/Lucifer-St/silent-orbit-skills-library/pull/2",
    "releaseGate": "pass",
    "deployPreview": "pass",
    "productionChanged": false
  },
  "receiptId": "738e417cb415ff4e3a2503a019b7a51ef82f21c6197be61b1c50e43af70e275c"
}
